{
  "schema_version": 1,
  "slug": "andy-bauch-new-money-cog-428ksats",
  "title": "Andy Bauch: New Money, COG",
  "tier": "solved",
  "status": "solved",
  "dead_end_reason": null,
  "series": "Andy Bauch, \"New Money\" (2016-2018)",
  "author": {
    "name": "Andy Bauch",
    "handles": [
      "web:andybauch.com"
    ],
    "url": "https://andybauch.com/"
  },
  "published": {
    "date": "2018-03-23",
    "url": "http://web.archive.org/web/20180921114353/https://www.artsy.net/show/hijinx-new-money"
  },
  "chain": "bitcoin",
  "prize": {
    "amount": 428206,
    "asset": "sats",
    "usd_estimate": 270,
    "usd_snapshot": "2026-08-16",
    "note": "the escrow received 527,872 sats on 2017-07-01, that amount left on 2017-12-30 and was replaced by the same funder the next day, 2017-12-31, with the 428,206 sats that remains unspent today"
  },
  "addresses": [
    {
      "address": "1HLodS8H2GoWbnBXWcz7EkY773dKdD4JEv",
      "chain": "bitcoin",
      "role": "escrow",
      "label": "main",
      "explorer": "https://mempool.space/address/1HLodS8H2GoWbnBXWcz7EkY773dKdD4JEv",
      "expected": "0 sats (428,206 sats until 2026-09-25)",
      "verified_on": "2026-09-26",
      "verified_state": "swept"
    }
  ],
  "puzzle_type": [
    "pixel-code",
    "physical-object"
  ],
  "target_format": "unknown; likely a 52-character compressed WIF private key (K or L prefix), P2PKH, based on the escrow's own compressed-pubkey spend",
  "derivation": {
    "summary": "a private key encoded as a pattern of colored LEGO bricks (mechanism used for COG specifically not yet fixed: color count, cell size and payload region are all unknown), decoded back to compressed and uncompressed P2PKH addresses and compared to the escrow",
    "oracle": "tools/oracle.py",
    "oracle_certified": true,
    "certified_against": "the private key behind the solved sibling piece BITCOIN $60 in the same series"
  },
  "difficulty_left": "external-info",
  "difficulty_note": "the general encoding method is understood and 2 of its known variants are ruled out for COG with witnessed negatives; the blocker is image fidelity (whether individual brick seams are visible), and the physical piece is held by a private collector who bought it in 2018, not the artist",
  "tested_total": {
    "candidates": 494000000,
    "families": 7,
    "certified": true
  },
  "leads": [
    {
      "rank": 1,
      "title": "a photograph resolving individual plate seams (about 40 px/stud or more), from the piece's current owner",
      "cost": "needs new information, from a specific person",
      "status": "open"
    },
    {
      "rank": 2,
      "title": "close the color-count gap in the region search (only 4 colors tried so far)",
      "cost": "bounded re-run",
      "status": "open"
    },
    {
      "rank": 3,
      "title": "series pieces from 2017 with no public photo yet",
      "cost": "OSINT, tooling ready",
      "status": "open"
    }
  ],
  "solutions": [
    {
      "lot": "main",
      "date": "2026-09-25",
      "answer": "unknown (swept without a published solution)",
      "key_material_disclosed": false,
      "payout_txid": "230bba19d8e60803f36cb88f428c20dcc88fb431e0f611ddb05d3432fa8c5947",
      "payout_amount": "427072 sats",
      "payout_to": "bc1qvzc2cgm99ewfmhrdadq6ru2m7296em7wefl6ca",
      "explorer": "https://mempool.space/tx/230bba19d8e60803f36cb88f428c20dcc88fb431e0f611ddb05d3432fa8c5947"
    }
  ],
  "artifacts": [
    {
      "path": "clues/COG_PANEL_1.jpg",
      "sha256": "54112d02936972345813892a0c74c413cb481eaa9cc9d6d93bc2fbbf8238771f",
      "source": "https://andybauch.com/museum-of-human-obsolescence",
      "archived": null
    },
    {
      "path": "clues/COG_PANEL_2.jpg",
      "sha256": "4007554ba0071b02cd2aca4eca0cd233d7ae70a14f5a13010931b931ea465ca2",
      "source": "https://andybauch.com/museum-of-human-obsolescence",
      "archived": null
    },
    {
      "path": "clues/COG_PANEL_3.jpg",
      "sha256": "5d42d5e74fe6a7d9dcd74098042c512d403fc605538e4e74012b8cf07af085e9",
      "source": "https://andybauch.com/museum-of-human-obsolescence",
      "archived": null
    }
  ],
  "sources": [
    {
      "title": "Andy Bauch, artist site",
      "url": "https://andybauch.com/",
      "date": "2026-08-16",
      "archived": null
    },
    {
      "title": "\"New Money\" show listing, Artsy",
      "url": "https://www.artsy.net/show/hijinx-new-money",
      "date": "2018-09-21",
      "archived": "http://web.archive.org/web/20180921114353/https://www.artsy.net/show/hijinx-new-money"
    },
    {
      "title": "\"New Money\" show listing showing COG's $14,000 price",
      "url": "https://www.artsy.net/show/hijinx-new-money",
      "date": "2018-03-24",
      "archived": "http://web.archive.org/web/20180324080626/https://www.artsy.net/show/hijinx-new-money"
    },
    {
      "title": "ESCAPUZZLED Podcast, episode 7",
      "url": "https://www.youtube.com/watch?v=nAz4DogvdPA",
      "date": "2024-08-14",
      "archived": null
    },
    {
      "title": "issue #35, sweep reported by Andy00L",
      "url": "https://github.com/floflo777/open-crypto-puzzles/issues/35",
      "date": "2026-09-26",
      "archived": null
    }
  ],
  "third_party_material": "installation and press photography of the show (Vice, Gizmodo, Whitehot and others) is not included; only the 3 panel images from the artist's own site and short quoted material are used",
  "last_updated": "2026-08-16"
}
