{
  "schema_version": 1,
  "slug": "genesis-block-wallet-puzzle-142ksats",
  "title": "Genesis Block Wallet Puzzle",
  "tier": "solved",
  "status": "solved",
  "dead_end_reason": null,
  "series": null,
  "author": {
    "name": "CaesarCoder (revealed on chain 2026-10-17 via PGP-signed OP_RETURN; previously anonymous, on-chain only)",
    "handles": [
      "github:caesrcd"
    ],
    "url": "https://github.com/caesrcd"
  },
  "published": {
    "date": "2026-08-22",
    "url": "https://mempool.space/tx/b691de3657880d9a1eabd2783b1a9fa8c5313ced338495bf10e85727012d7a77"
  },
  "chain": "bitcoin",
  "prize": {
    "amount": 947620,
    "asset": "sats",
    "usd_estimate": 106,
    "usd_snapshot": "2026-08-16",
    "note": "grew from 142,779 sats (2026-08-29) to 168,779 (2026-09-12) and ultimately 947,620 sats as paid questions were relayed into the escrow; fully swept 2026-10-17"
  },
  "addresses": [
    {
      "address": "bc1qfkhx02v89u2qyyyljeczw6hu9sr437y44t7ae5yf09thrdukfqesnjg2wj",
      "chain": "bitcoin",
      "role": "escrow",
      "label": "main (P2WSH, witness program 4dae67a9872f1402109f9670276afc2c0758f895aafddcd089795771b7964833)",
      "explorer": "https://mempool.space/address/bc1qfkhx02v89u2qyyyljeczw6hu9sr437y44t7ae5yf09thrdukfqesnjg2wj",
      "expected": "0 sats (947,620 sats total funded, fully swept 2026-10-17)",
      "verified_on": "2026-10-18",
      "verified_state": "swept"
    },
    {
      "address": "bc1qdu8mh9qjtjhy89mvhmcgf66ul6ld92rdr6qzad",
      "chain": "bitcoin",
      "role": "payout",
      "label": "solver's payout address (took the main sweep of 935,266 sats plus later dust; has onward activity)",
      "explorer": "https://mempool.space/address/bc1qdu8mh9qjtjhy89mvhmcgf66ul6ld92rdr6qzad",
      "expected": "n/a",
      "verified_on": "2026-10-18",
      "verified_state": "partially-spent"
    }
  ],
  "puzzle_type": [
    "multisig",
    "bip39-seed",
    "raw-private-key"
  ],
  "target_format": "P2WSH v0; witness script OP_2 <keyA> <keyB> OP_2 OP_CHECKMULTISIG; two cosigners, each a 12-word BIP39 mnemonic whose entropy is a cut range of the genesis block raw hex, hashed (SHA-256, first 32 hex digits as raw entropy via Ian Coleman's tool), with a BIP39 passphrase, derived at BIP48 m/48'/0'/account'/2'",
  "derivation": {
    "summary": "cut -b N-M on the lowercase genesis raw-block hex (570 hex chars), sha256sum the cut text, first 32 hex digits of the digest as raw entropy in Ian Coleman's BIP39 tool (Entropy Type Hex), 12 English words, BIP39 passphrase, BIP48 m/48'/0'/account'/2' for each of two cosigners; build the 2-of-2 witness script, sha256, compare with the published witness program",
    "oracle": "tools/oracle.py",
    "oracle_certified": true,
    "certified_against": "the BIP-173 P2WSH test vector, and a real 2-of-2 P2WSH spent in block 963629 (tx 47ded3504e855ce418e46eeca4694b55a623d1e23a8e3c83292abbcf9cee9f7a, input 0) whose revealed keys rebuild the script and hash to the spent address; private key 1 to the generator point; negative control against the escrow"
  },
  "difficulty_left": "none",
  "difficulty_note": "solved 2026-10-17 by an independent solver after 8 weeks; the GPU key search was not the bottleneck (the solver's own post-sweep OP_RETURN: 'My GPU searched everywhere except the PBKDF2 settings'); the binding insight was the BIP39 passphrase step, for which the author's only public nudge was 'Who received the first transaction?' The exact cut ranges, passphrases and account numbers remain unpublished; the on-chain dialogue (blocks 963629-971896) is the primary record",
  "tested_total": {
    "candidates": 573973795610,
    "families": 8,
    "certified": true
  },
  "leads": [
    {
      "rank": 1,
      "title": "closed: the escrow was swept on 2026-10-17 (tx 1c70c474, 935,266 sats to bc1qdu8mh...); all leads below are historical",
      "cost": "n/a",
      "status": "killed"
    },
    {
      "rank": 2,
      "title": "ask the author about the passphrase's nature on chain (79-byte draft in the README); pass 3 shows it is none of 53 obvious readings of the block",
      "cost": "needs-a-person",
      "status": "killed"
    },
    {
      "rank": 3,
      "title": "pass 3 wave 2: text variants and every coinbase-text substring as passphrase",
      "cost": "minutes on one rented GPU",
      "status": "killed"
    },
    {
      "rank": 4,
      "title": "watch the escrow for new OP_RETURN hints or a spend before any work",
      "cost": "minutes",
      "status": "killed"
    },
    {
      "rank": 5,
      "title": "pass 3: 16-byte genesis windows as 12-word entropy, 53 passphrases, genesis integers as BIP48 account, script types 0/1/2, keys paired (2.46e12 pairs)",
      "cost": "minutes",
      "status": "killed"
    },
    {
      "rank": 6,
      "title": "pass 2: library-specific roots (hashed roots, raw 64-byte extended key, raw key with zero chain code) along the same 214 paths",
      "cost": "minutes",
      "status": "killed"
    },
    {
      "rank": 7,
      "title": "pass 1: literal readings of the 2026-08-28 hints, families A to D",
      "cost": "minutes",
      "status": "killed"
    }
  ],
  "solutions": [
    {
      "lot": "main",
      "date": "2026-10-17",
      "answer": "unpublished: the solver's OP_RETURN says the GPU covered the key space and the binding step was the BIP39 PBKDF2 passphrase settings; the author's public hint for the passphrase was 'Who received the first transaction?'; the two cosigner master fingerprints 0852014c and 040e2791 and the cut -b / sha256sum / Ian Coleman Hex procedure were confirmed on chain during the solve dialogue",
      "key_material_disclosed": false,
      "payout_txid": "1c70c4745fad5bf891b9ee2a9f8b0b5cd3f328eb847eb09c9bebb92f5f7e900b",
      "payout_amount": "935,266 sats (main sweep, block 971803); later dust sweeps brought the total to 947,620 sats",
      "payout_to": "bc1qdu8mh9qjtjhy89mvhmcgf66ul6ld92rdr6qzad",
      "explorer": "https://mempool.space/tx/1c70c4745fad5bf891b9ee2a9f8b0b5cd3f328eb847eb09c9bebb92f5f7e900b"
    }
  ],
  "artifacts": [],
  "sources": [
    {
      "title": "Announcement transaction, block 963629",
      "url": "https://mempool.space/tx/b691de3657880d9a1eabd2783b1a9fa8c5313ced338495bf10e85727012d7a77",
      "date": "2026-08-22",
      "archived": null
    },
    {
      "title": "Escrow address and full on-chain dialogue",
      "url": "https://mempool.space/address/bc1qfkhx02v89u2qyyyljeczw6hu9sr437y44t7ae5yf09thrdukfqesnjg2wj",
      "date": "2026-08-29",
      "archived": null
    },
    {
      "title": "Main sweep transaction (solver takes 935,266 sats)",
      "url": "https://mempool.space/tx/1c70c4745fad5bf891b9ee2a9f8b0b5cd3f328eb847eb09c9bebb92f5f7e900b",
      "date": "2026-10-17",
      "archived": null
    },
    {
      "title": "Solver's post-sweep OP_RETURN: 'My GPU searched everywhere except the PBKDF2 settings. Well played!'",
      "url": "https://mempool.space/tx/4b2d29ec21e2c9a37dae5ca7ddc49d6f34b0efbf4b0aa1afed6405dec8067b78",
      "date": "2026-10-17",
      "archived": null
    },
    {
      "title": "Author PGP-signed on-chain reveal as CaesarCoder",
      "url": "https://mempool.space/tx/473a314bcb3f5abc8dc4500e8d0ab80525ff65a846d55406c1e1e10fa8c8e46c",
      "date": "2026-10-17",
      "archived": null
    },
    {
      "title": "Galaxy Research, first public report (X)",
      "url": "https://x.com/glxyresearch/status/2091349771952742566",
      "date": "2026-08-23",
      "archived": null
    },
    {
      "title": "crypto.news, Bitcoin puzzle hides wallet key in Genesis Block data",
      "url": "https://crypto.news/bitcoin-puzzle-hides-wallet-key-in-genesis-block-data/",
      "date": "2026-08-23",
      "archived": null
    },
    {
      "title": "U.Today, Satoshi's Code Reopened",
      "url": "https://u.today/satoshis-code-reopened-someone-just-deciphered-bitcoin-puzzle-into-genesis-block-data",
      "date": "2026-08-23",
      "archived": null
    },
    {
      "title": "Blockmedia (Korean)",
      "url": "https://www.blockmedia.co.kr/archives/1131026",
      "date": "2026-08-23",
      "archived": null
    }
  ],
  "third_party_material": "none: the genesis block and the author's OP_RETURN messages are public chain data; press articles are linked, not reproduced",
  "last_updated": "2026-10-18"
}
