{
  "schema_version": 1,
  "slug": "corey-phillips-kitten-passphrase-1msats",
  "title": "Corey Phillips: Kitten Passphrase Puzzle",
  "tier": "mid",
  "status": "open",
  "dead_end_reason": null,
  "series": null,
  "author": {
    "name": "Corey Phillips",
    "handles": ["medium:corey-lyle-phillips", "github:coreyphillips", "x:coreylphillips"],
    "url": "https://corey-lyle-phillips.medium.com/"
  },
  "published": {
    "date": "2019-07-09",
    "url": "https://corey-lyle-phillips.medium.com/part-1-3-turn-your-photos-into-bitcoin-private-keys-addresses-57669771cf7a"
  },
  "chain": "bitcoin",
  "prize": {
    "amount": 1001900,
    "asset": "sats",
    "usd_estimate": 631,
    "usd_snapshot": "2026-08-16",
    "note": "2 funding UTXOs summing to 1,001,900 sats, 0 spent as of 2026-08-16"
  },
  "addresses": [
    { "address": "bc1qcyrndzgy036f6ax370g8zyvlw86ulawgt0246r", "chain": "bitcoin", "role": "escrow", "label": "main", "explorer": "https://mempool.space/address/bc1qcyrndzgy036f6ax370g8zyvlw86ulawgt0246r", "expected": "1001900 sats", "verified_on": "2026-08-16", "verified_state": "funded-unspent" },
    { "address": "bc1q57euh23y3qs2f9d5mtwpax5lqecfvrdkqce82a", "chain": "bitcoin", "role": "decoy", "label": "sister (empty passphrase, oracle calibration only, not a target)", "explorer": "https://mempool.space/address/bc1q57euh23y3qs2f9d5mtwpax5lqecfvrdkqce82a", "expected": "n/a, not a prize address", "verified_on": "2026-08-16", "verified_state": "swept" }
  ],
  "puzzle_type": ["bip39-seed", "brainwallet"],
  "target_format": "BIP39 24 words (fixed, public), unknown passphrase, BIP84 m/84'/0'/0'/0/0",
  "derivation": {
    "summary": "hash the published image (base64 then SHA-256) to get fixed BIP39 entropy for a public 24-word mnemonic; the unknown passphrase plus the mnemonic derive the seed, then BIP84 m/84'/0'/0'/0/0 gives the P2WPKH address",
    "oracle": "tools/oracle.py",
    "oracle_certified": true,
    "certified_against": "the sister address bc1q57euh23y3qs2f9d5mtwpax5lqecfvrdkqce82a for an empty passphrase, and sha256(base64(kitten.jpeg)) matching the author's own published value"
  },
  "difficulty_left": "external-info",
  "difficulty_note": "the mnemonic and derivation are fully certified; about 1.155 billion passphrase candidates have been tested across curated, rule-mangled, raw wordlist, and thematic-combinator regions with 0 matches; the author states the puzzle is not meant to be solved, so the passphrase is a freely chosen secret with no confirmed public provenance",
  "tested_total": { "candidates": 1155420596, "families": 13, "certified": true },
  "leads": [
    { "rank": 1, "title": "ask the author directly", "cost": "needs-a-person", "status": "open" },
    { "rank": 2, "title": "safety-net derivation on BIP44 and BIP49", "cost": "minutes", "status": "closed" },
    { "rank": 3, "title": "three-word thematic combinator", "cost": "hours", "status": "closed" }
  ],
  "solutions": [],
  "artifacts": [
    { "path": "clues/kitten.jpeg", "sha256": "b988e0881a0211222e83f3e2a4bfac695c951bf96aa33ec112fab6992f5e7343", "source": "https://corey-lyle-phillips.medium.com/part-1-3-turn-your-photos-into-bitcoin-private-keys-addresses-57669771cf7a", "archived": null }
  ],
  "sources": [
    { "title": "Part 1/3: Turn Your Photos Into Bitcoin Private Keys/Addresses", "url": "https://corey-lyle-phillips.medium.com/part-1-3-turn-your-photos-into-bitcoin-private-keys-addresses-57669771cf7a", "date": "2019-07-09", "archived": null },
    { "title": "A Bitcoin Audio Puzzle", "url": "https://corey-lyle-phillips.medium.com/a-bitcoin-audio-puzzle-61174b9849ce", "date": "2020-01-05", "archived": null },
    { "title": "BTC-Puzzle-by-Corey-Phillips (community hint repository)", "url": "https://github.com/Schum-io/BTC-Puzzle-by-Corey-Phillips", "date": "2026-08-16", "archived": null },
    { "title": "bitimage (author's tool)", "url": "https://github.com/coreyphillips/bitimage", "date": "2026-08-16", "archived": null }
  ],
  "third_party_material": "clues/kitten.jpeg is the author-published puzzle image, byte-identical to the original, sha256 recorded in artifacts[]; no wordlists or third-party bulk data included, only my own derived candidate counts",
  "last_updated": "2026-08-27"
}
